Fine-tuning started at 2026-01-22 15:41:47.061392
================================================================================
Config: *******
Output directory: *******
Task type: classification
================================================================================

[2026-01-22 15:49:20] Epoch 0 Training - loss: 0.6935 | lr: 0.0000 | acc: 0.4832
[2026-01-22 15:52:39] Test averaged stats: acc: 0.5000 (0.4958)  loss: 0.6909 (0.6934)  f1: 0.3310 (0.3310)
[2026-01-22 15:52:39] Epoch 0 Validation - acc: 0.5106 | loss: 0.6918
[2026-01-22 15:52:39] Epoch 0 Test - acc: 0.4958 | loss: 0.6934 | f1: 0.3310
[2026-01-22 15:52:45] Checkpoint saved at epoch 0
[2026-01-22 15:52:45] New best validation accuracy: 0.5106
[2026-01-22 15:59:49] Epoch 1 Training - loss: 0.6914 | lr: 0.0001 | acc: 0.5210
[2026-01-22 16:03:02] Test averaged stats: acc: 0.5625 (0.5521)  loss: 0.6872 (0.6890)  f1: 0.5080 (0.5080)
[2026-01-22 16:03:02] Epoch 1 Validation - acc: 0.5819 | loss: 0.6881
[2026-01-22 16:03:02] Epoch 1 Test - acc: 0.5521 | loss: 0.6890 | f1: 0.5080
[2026-01-22 16:03:03] Checkpoint saved at epoch 1
[2026-01-22 16:03:03] New best validation accuracy: 0.5819
[2026-01-22 16:10:07] Epoch 2 Training - loss: 0.6874 | lr: 0.0001 | acc: 0.5673
[2026-01-22 16:13:15] Test averaged stats: acc: 0.5000 (0.5500)  loss: 0.6824 (0.6844)  f1: 0.5008 (0.5008)
[2026-01-22 16:13:15] Epoch 2 Validation - acc: 0.5611 | loss: 0.6832
[2026-01-22 16:13:15] Epoch 2 Test - acc: 0.5500 | loss: 0.6844 | f1: 0.5008
[2026-01-22 16:13:16] Checkpoint saved at epoch 2
[2026-01-22 16:20:03] Epoch 3 Training - loss: 0.6836 | lr: 0.0001 | acc: 0.5475
[2026-01-22 16:23:15] Test averaged stats: acc: 0.6250 (0.6250)  loss: 0.6777 (0.6779)  f1: 0.6236 (0.6236)
[2026-01-22 16:23:15] Epoch 3 Validation - acc: 0.6242 | loss: 0.6790
[2026-01-22 16:23:15] Epoch 3 Test - acc: 0.6250 | loss: 0.6779 | f1: 0.6236
[2026-01-22 16:23:17] Checkpoint saved at epoch 3
[2026-01-22 16:23:17] New best validation accuracy: 0.6242
[2026-01-22 16:29:56] Epoch 4 Training - loss: 0.6803 | lr: 0.0001 | acc: 0.5919
[2026-01-22 16:33:04] Test averaged stats: acc: 0.6250 (0.6438)  loss: 0.6731 (0.6720)  f1: 0.6420 (0.6420)
[2026-01-22 16:33:04] Epoch 4 Validation - acc: 0.6200 | loss: 0.6742
[2026-01-22 16:33:04] Epoch 4 Test - acc: 0.6438 | loss: 0.6720 | f1: 0.6420
[2026-01-22 16:33:07] Checkpoint saved at epoch 4
[2026-01-22 16:39:52] Epoch 5 Training - loss: 0.6750 | lr: 0.0001 | acc: 0.6046
[2026-01-22 16:43:10] Test averaged stats: acc: 0.6250 (0.6333)  loss: 0.6651 (0.6665)  f1: 0.6285 (0.6285)
[2026-01-22 16:43:10] Epoch 5 Validation - acc: 0.6325 | loss: 0.6686
[2026-01-22 16:43:10] Epoch 5 Test - acc: 0.6333 | loss: 0.6665 | f1: 0.6285
[2026-01-22 16:43:11] Checkpoint saved at epoch 5
[2026-01-22 16:43:11] New best validation accuracy: 0.6325
[2026-01-22 16:49:55] Epoch 6 Training - loss: 0.6692 | lr: 0.0001 | acc: 0.6064
[2026-01-22 16:53:04] Test averaged stats: acc: 0.5312 (0.5604)  loss: 0.6669 (0.6686)  f1: 0.5042 (0.5042)
[2026-01-22 16:53:04] Epoch 6 Validation - acc: 0.5736 | loss: 0.6677
[2026-01-22 16:53:04] Epoch 6 Test - acc: 0.5604 | loss: 0.6686 | f1: 0.5042
[2026-01-22 16:53:04] Checkpoint saved at epoch 6
[2026-01-22 16:59:57] Epoch 7 Training - loss: 0.6662 | lr: 0.0001 | acc: 0.6184
[2026-01-22 17:03:01] Test averaged stats: acc: 0.6250 (0.6354)  loss: 0.6562 (0.6553)  f1: 0.6271 (0.6271)
[2026-01-22 17:03:01] Epoch 7 Validation - acc: 0.6492 | loss: 0.6590
[2026-01-22 17:03:01] Epoch 7 Test - acc: 0.6354 | loss: 0.6553 | f1: 0.6271
[2026-01-22 17:03:04] Checkpoint saved at epoch 7
[2026-01-22 17:03:04] New best validation accuracy: 0.6492
[2026-01-22 17:09:55] Epoch 8 Training - loss: 0.6595 | lr: 0.0001 | acc: 0.6280
[2026-01-22 17:12:53] Test averaged stats: acc: 0.6250 (0.6458)  loss: 0.6522 (0.6482)  f1: 0.6453 (0.6453)
[2026-01-22 17:12:53] Epoch 8 Validation - acc: 0.6789 | loss: 0.6538
[2026-01-22 17:12:53] Epoch 8 Test - acc: 0.6458 | loss: 0.6482 | f1: 0.6453
[2026-01-22 17:12:54] Checkpoint saved at epoch 8
[2026-01-22 17:12:54] New best validation accuracy: 0.6789
[2026-01-22 17:19:18] Epoch 9 Training - loss: 0.6534 | lr: 0.0001 | acc: 0.6304
[2026-01-22 17:22:15] Test averaged stats: acc: 0.6250 (0.6354)  loss: 0.6422 (0.6443)  f1: 0.6255 (0.6255)
[2026-01-22 17:22:15] Epoch 9 Validation - acc: 0.6078 | loss: 0.6535
[2026-01-22 17:22:15] Epoch 9 Test - acc: 0.6354 | loss: 0.6443 | f1: 0.6255
[2026-01-22 17:22:15] Checkpoint saved at epoch 9
[2026-01-22 17:28:39] Epoch 10 Training - loss: 0.6500 | lr: 0.0001 | acc: 0.6328
[2026-01-22 17:31:42] Test averaged stats: acc: 0.6250 (0.6458)  loss: 0.6352 (0.6375)  f1: 0.6454 (0.6454)
[2026-01-22 17:31:42] Epoch 10 Validation - acc: 0.6789 | loss: 0.6430
[2026-01-22 17:31:42] Epoch 10 Test - acc: 0.6458 | loss: 0.6375 | f1: 0.6454
[2026-01-22 17:31:42] Checkpoint saved at epoch 10
[2026-01-22 17:38:12] Epoch 11 Training - loss: 0.6462 | lr: 0.0001 | acc: 0.6364
[2026-01-22 17:41:16] Test averaged stats: acc: 0.5625 (0.6188)  loss: 0.6523 (0.6495)  f1: 0.5934 (0.5934)
[2026-01-22 17:41:16] Epoch 11 Validation - acc: 0.6444 | loss: 0.6460
[2026-01-22 17:41:16] Epoch 11 Test - acc: 0.6188 | loss: 0.6495 | f1: 0.5934
[2026-01-22 17:41:17] Checkpoint saved at epoch 11
[2026-01-22 17:47:28] Epoch 12 Training - loss: 0.6407 | lr: 0.0001 | acc: 0.6430
[2026-01-22 17:50:22] Test averaged stats: acc: 0.5938 (0.6333)  loss: 0.6401 (0.6334)  f1: 0.6295 (0.6295)
[2026-01-22 17:50:22] Epoch 12 Validation - acc: 0.6658 | loss: 0.6336
[2026-01-22 17:50:22] Epoch 12 Test - acc: 0.6333 | loss: 0.6334 | f1: 0.6295
[2026-01-22 17:50:23] Checkpoint saved at epoch 12
[2026-01-22 17:56:40] Epoch 13 Training - loss: 0.6359 | lr: 0.0001 | acc: 0.6442
[2026-01-22 17:59:23] Test averaged stats: acc: 0.6250 (0.6458)  loss: 0.6354 (0.6269)  f1: 0.6446 (0.6446)
[2026-01-22 17:59:23] Epoch 13 Validation - acc: 0.6747 | loss: 0.6285
[2026-01-22 17:59:23] Epoch 13 Test - acc: 0.6458 | loss: 0.6269 | f1: 0.6446
[2026-01-22 17:59:23] Checkpoint saved at epoch 13
[2026-01-22 18:05:54] Epoch 14 Training - loss: 0.6325 | lr: 0.0001 | acc: 0.6532
[2026-01-22 18:08:43] Test averaged stats: acc: 0.6562 (0.6542)  loss: 0.6208 (0.6214)  f1: 0.6542 (0.6542)
[2026-01-22 18:08:43] Epoch 14 Validation - acc: 0.6956 | loss: 0.6247
[2026-01-22 18:08:43] Epoch 14 Test - acc: 0.6542 | loss: 0.6214 | f1: 0.6542
[2026-01-22 18:08:44] Checkpoint saved at epoch 14
[2026-01-22 18:08:44] New best validation accuracy: 0.6956
[2026-01-22 18:14:27] Epoch 15 Training - loss: 0.6274 | lr: 0.0001 | acc: 0.6544
[2026-01-22 18:17:06] Test averaged stats: acc: 0.6250 (0.6542)  loss: 0.6337 (0.6239)  f1: 0.6502 (0.6502)
[2026-01-22 18:17:06] Epoch 15 Validation - acc: 0.6744 | loss: 0.6215
[2026-01-22 18:17:06] Epoch 15 Test - acc: 0.6542 | loss: 0.6239 | f1: 0.6502
[2026-01-22 18:17:06] Checkpoint saved at epoch 15
[2026-01-22 18:22:49] Epoch 16 Training - loss: 0.6268 | lr: 0.0001 | acc: 0.6502
[2026-01-22 18:25:27] Test averaged stats: acc: 0.6875 (0.6646)  loss: 0.6084 (0.6154)  f1: 0.6639 (0.6639)
[2026-01-22 18:25:27] Epoch 16 Validation - acc: 0.6956 | loss: 0.6192
[2026-01-22 18:25:27] Epoch 16 Test - acc: 0.6646 | loss: 0.6154 | f1: 0.6639
[2026-01-22 18:25:28] Checkpoint saved at epoch 16
[2026-01-22 18:30:55] Epoch 17 Training - loss: 0.6214 | lr: 0.0001 | acc: 0.6611
[2026-01-22 18:33:37] Test averaged stats: acc: 0.6875 (0.6625)  loss: 0.6188 (0.6141)  f1: 0.6620 (0.6620)
[2026-01-22 18:33:37] Epoch 17 Validation - acc: 0.6747 | loss: 0.6130
[2026-01-22 18:33:37] Epoch 17 Test - acc: 0.6625 | loss: 0.6141 | f1: 0.6620
[2026-01-22 18:33:37] Checkpoint saved at epoch 17
[2026-01-22 18:39:08] Epoch 18 Training - loss: 0.6162 | lr: 0.0001 | acc: 0.6569
[2026-01-22 18:41:43] Test averaged stats: acc: 0.6875 (0.6604)  loss: 0.6058 (0.6112)  f1: 0.6567 (0.6567)
[2026-01-22 18:41:43] Epoch 18 Validation - acc: 0.6622 | loss: 0.6166
[2026-01-22 18:41:43] Epoch 18 Test - acc: 0.6604 | loss: 0.6112 | f1: 0.6567
[2026-01-22 18:41:44] Checkpoint saved at epoch 18
[2026-01-22 18:47:08] Epoch 19 Training - loss: 0.6160 | lr: 0.0001 | acc: 0.6611
[2026-01-22 18:49:42] Test averaged stats: acc: 0.6875 (0.6729)  loss: 0.6016 (0.6074)  f1: 0.6718 (0.6718)
[2026-01-22 18:49:42] Epoch 19 Validation - acc: 0.6997 | loss: 0.6078
[2026-01-22 18:49:42] Epoch 19 Test - acc: 0.6729 | loss: 0.6074 | f1: 0.6718
[2026-01-22 18:49:43] Checkpoint saved at epoch 19
[2026-01-22 18:49:43] New best validation accuracy: 0.6997
[2026-01-22 18:55:09] Epoch 20 Training - loss: 0.6130 | lr: 0.0001 | acc: 0.6587
[2026-01-22 18:57:46] Test averaged stats: acc: 0.7188 (0.6708)  loss: 0.5957 (0.6061)  f1: 0.6684 (0.6684)
[2026-01-22 18:57:46] Epoch 20 Validation - acc: 0.6831 | loss: 0.6087
[2026-01-22 18:57:46] Epoch 20 Test - acc: 0.6708 | loss: 0.6061 | f1: 0.6684
[2026-01-22 18:57:47] Checkpoint saved at epoch 20
[2026-01-22 19:03:30] Epoch 21 Training - loss: 0.6090 | lr: 0.0001 | acc: 0.6677
[2026-01-22 19:06:09] Test averaged stats: acc: 0.6875 (0.6729)  loss: 0.6121 (0.6060)  f1: 0.6724 (0.6724)
[2026-01-22 19:06:09] Epoch 21 Validation - acc: 0.6869 | loss: 0.5997
[2026-01-22 19:06:09] Epoch 21 Test - acc: 0.6729 | loss: 0.6060 | f1: 0.6724
[2026-01-22 19:06:09] Checkpoint saved at epoch 21
[2026-01-22 19:11:30] Epoch 22 Training - loss: 0.6024 | lr: 0.0001 | acc: 0.6857
[2026-01-22 19:14:07] Test averaged stats: acc: 0.6875 (0.6875)  loss: 0.5942 (0.6020)  f1: 0.6842 (0.6842)
[2026-01-22 19:14:07] Epoch 22 Validation - acc: 0.6619 | loss: 0.6053
[2026-01-22 19:14:07] Epoch 22 Test - acc: 0.6875 | loss: 0.6020 | f1: 0.6842
[2026-01-22 19:14:08] Checkpoint saved at epoch 22
[2026-01-22 19:19:35] Epoch 23 Training - loss: 0.6029 | lr: 0.0001 | acc: 0.6809
[2026-01-22 19:22:13] Test averaged stats: acc: 0.6875 (0.6625)  loss: 0.6015 (0.6012)  f1: 0.6624 (0.6624)
[2026-01-22 19:22:13] Epoch 23 Validation - acc: 0.6953 | loss: 0.5927
[2026-01-22 19:22:13] Epoch 23 Test - acc: 0.6625 | loss: 0.6012 | f1: 0.6624
[2026-01-22 19:22:14] Checkpoint saved at epoch 23
[2026-01-22 19:27:49] Epoch 24 Training - loss: 0.6018 | lr: 0.0001 | acc: 0.6791
[2026-01-22 19:30:33] Test averaged stats: acc: 0.6875 (0.6646)  loss: 0.6302 (0.6199)  f1: 0.6524 (0.6524)
[2026-01-22 19:30:33] Epoch 24 Validation - acc: 0.6739 | loss: 0.6020
[2026-01-22 19:30:33] Epoch 24 Test - acc: 0.6646 | loss: 0.6199 | f1: 0.6524
[2026-01-22 19:30:33] Checkpoint saved at epoch 24
[2026-01-22 19:36:11] Epoch 25 Training - loss: 0.5987 | lr: 0.0001 | acc: 0.6701
[2026-01-22 19:38:49] Test averaged stats: acc: 0.7188 (0.6771)  loss: 0.5977 (0.5976)  f1: 0.6769 (0.6769)
[2026-01-22 19:38:49] Epoch 25 Validation - acc: 0.6953 | loss: 0.5891
[2026-01-22 19:38:49] Epoch 25 Test - acc: 0.6771 | loss: 0.5976 | f1: 0.6769
[2026-01-22 19:38:50] Checkpoint saved at epoch 25
[2026-01-22 19:44:24] Epoch 26 Training - loss: 0.5944 | lr: 0.0001 | acc: 0.6827
[2026-01-22 19:47:03] Test averaged stats: acc: 0.6875 (0.6792)  loss: 0.6227 (0.6045)  f1: 0.6752 (0.6752)
[2026-01-22 19:47:03] Epoch 26 Validation - acc: 0.7078 | loss: 0.5882
[2026-01-22 19:47:03] Epoch 26 Test - acc: 0.6792 | loss: 0.6045 | f1: 0.6752
[2026-01-22 19:47:04] Checkpoint saved at epoch 26
[2026-01-22 19:47:04] New best validation accuracy: 0.7078
[2026-01-22 19:52:42] Epoch 27 Training - loss: 0.5926 | lr: 0.0001 | acc: 0.6911
[2026-01-22 19:55:19] Test averaged stats: acc: 0.7188 (0.6792)  loss: 0.5999 (0.5947)  f1: 0.6788 (0.6788)
[2026-01-22 19:55:19] Epoch 27 Validation - acc: 0.6869 | loss: 0.5823
[2026-01-22 19:55:19] Epoch 27 Test - acc: 0.6792 | loss: 0.5947 | f1: 0.6788
[2026-01-22 19:55:19] Checkpoint saved at epoch 27
[2026-01-22 20:01:06] Epoch 28 Training - loss: 0.5896 | lr: 0.0001 | acc: 0.6857
[2026-01-22 20:03:47] Test averaged stats: acc: 0.6875 (0.6896)  loss: 0.5756 (0.5924)  f1: 0.6870 (0.6870)
[2026-01-22 20:03:47] Epoch 28 Validation - acc: 0.6783 | loss: 0.5884
[2026-01-22 20:03:47] Epoch 28 Test - acc: 0.6896 | loss: 0.5924 | f1: 0.6870
[2026-01-22 20:03:47] Checkpoint saved at epoch 28
[2026-01-22 20:09:19] Epoch 29 Training - loss: 0.5882 | lr: 0.0001 | acc: 0.6965
[2026-01-22 20:12:03] Test averaged stats: acc: 0.6875 (0.6896)  loss: 0.5728 (0.5901)  f1: 0.6885 (0.6885)
[2026-01-22 20:12:03] Epoch 29 Validation - acc: 0.6953 | loss: 0.5797
[2026-01-22 20:12:03] Epoch 29 Test - acc: 0.6896 | loss: 0.5901 | f1: 0.6885
[2026-01-22 20:12:04] Checkpoint saved at epoch 29
[2026-01-22 20:17:26] Epoch 30 Training - loss: 0.5864 | lr: 0.0001 | acc: 0.6929
[2026-01-22 20:19:58] Test averaged stats: acc: 0.7500 (0.6771)  loss: 0.6088 (0.5978)  f1: 0.6755 (0.6755)
[2026-01-22 20:19:58] Epoch 30 Validation - acc: 0.7078 | loss: 0.5754
[2026-01-22 20:19:58] Epoch 30 Test - acc: 0.6771 | loss: 0.5978 | f1: 0.6755
[2026-01-22 20:19:58] Checkpoint saved at epoch 30
[2026-01-22 20:25:21] Epoch 31 Training - loss: 0.5852 | lr: 0.0001 | acc: 0.6977
[2026-01-22 20:27:52] Test averaged stats: acc: 0.7188 (0.6854)  loss: 0.5820 (0.5865)  f1: 0.6854 (0.6854)
[2026-01-22 20:27:52] Epoch 31 Validation - acc: 0.6994 | loss: 0.5719
[2026-01-22 20:27:52] Epoch 31 Test - acc: 0.6854 | loss: 0.5865 | f1: 0.6854
[2026-01-22 20:27:52] Checkpoint saved at epoch 31
[2026-01-22 20:33:12] Epoch 32 Training - loss: 0.5826 | lr: 0.0001 | acc: 0.6941
[2026-01-22 20:35:46] Test averaged stats: acc: 0.7188 (0.6937)  loss: 0.5933 (0.5879)  f1: 0.6930 (0.6930)
[2026-01-22 20:35:46] Epoch 32 Validation - acc: 0.7203 | loss: 0.5714
[2026-01-22 20:35:46] Epoch 32 Test - acc: 0.6937 | loss: 0.5879 | f1: 0.6930
[2026-01-22 20:35:47] Checkpoint saved at epoch 32
[2026-01-22 20:35:47] New best validation accuracy: 0.7203
[2026-01-22 20:41:01] Epoch 33 Training - loss: 0.5817 | lr: 0.0001 | acc: 0.7031
[2026-01-22 20:43:25] Test averaged stats: acc: 0.7500 (0.7000)  loss: 0.5785 (0.5845)  f1: 0.7000 (0.7000)
[2026-01-22 20:43:25] Epoch 33 Validation - acc: 0.7036 | loss: 0.5688
[2026-01-22 20:43:25] Epoch 33 Test - acc: 0.7000 | loss: 0.5845 | f1: 0.7000
[2026-01-22 20:43:25] Checkpoint saved at epoch 33
[2026-01-22 20:49:03] Epoch 34 Training - loss: 0.5726 | lr: 0.0001 | acc: 0.7145
[2026-01-22 20:51:36] Test averaged stats: acc: 0.7500 (0.7021)  loss: 0.5716 (0.5825)  f1: 0.7021 (0.7021)
[2026-01-22 20:51:36] Epoch 34 Validation - acc: 0.7036 | loss: 0.5664
[2026-01-22 20:51:36] Epoch 34 Test - acc: 0.7021 | loss: 0.5825 | f1: 0.7021
[2026-01-22 20:51:36] Checkpoint saved at epoch 34
[2026-01-22 20:56:52] Epoch 35 Training - loss: 0.5766 | lr: 0.0001 | acc: 0.7139
[2026-01-22 20:59:22] Test averaged stats: acc: 0.7500 (0.7021)  loss: 0.5610 (0.5827)  f1: 0.7009 (0.7009)
[2026-01-22 20:59:22] Epoch 35 Validation - acc: 0.6908 | loss: 0.5678
[2026-01-22 20:59:22] Epoch 35 Test - acc: 0.7021 | loss: 0.5827 | f1: 0.7009
[2026-01-22 20:59:22] Checkpoint saved at epoch 35
[2026-01-22 21:04:39] Epoch 36 Training - loss: 0.5750 | lr: 0.0001 | acc: 0.7127
[2026-01-22 21:07:10] Test averaged stats: acc: 0.6875 (0.6833)  loss: 0.6144 (0.5955)  f1: 0.6771 (0.6771)
[2026-01-22 21:07:10] Epoch 36 Validation - acc: 0.7200 | loss: 0.5702
[2026-01-22 21:07:10] Epoch 36 Test - acc: 0.6833 | loss: 0.5955 | f1: 0.6771
[2026-01-22 21:07:11] Checkpoint saved at epoch 36
[2026-01-22 21:12:34] Epoch 37 Training - loss: 0.5713 | lr: 0.0001 | acc: 0.7127
[2026-01-22 21:15:07] Test averaged stats: acc: 0.6875 (0.6979)  loss: 0.5688 (0.5828)  f1: 0.6938 (0.6938)
[2026-01-22 21:15:07] Epoch 37 Validation - acc: 0.6825 | loss: 0.5722
[2026-01-22 21:15:07] Epoch 37 Test - acc: 0.6979 | loss: 0.5828 | f1: 0.6938
[2026-01-22 21:15:08] Checkpoint saved at epoch 37
[2026-01-22 21:20:43] Epoch 38 Training - loss: 0.5715 | lr: 0.0001 | acc: 0.7115
[2026-01-22 21:23:18] Test averaged stats: acc: 0.7500 (0.7042)  loss: 0.5803 (0.5814)  f1: 0.7036 (0.7036)
[2026-01-22 21:23:18] Epoch 38 Validation - acc: 0.7161 | loss: 0.5602
[2026-01-22 21:23:18] Epoch 38 Test - acc: 0.7042 | loss: 0.5814 | f1: 0.7036
[2026-01-22 21:23:18] Checkpoint saved at epoch 38
[2026-01-22 21:28:45] Epoch 39 Training - loss: 0.5680 | lr: 0.0001 | acc: 0.7079
[2026-01-22 21:31:22] Test averaged stats: acc: 0.7500 (0.7146)  loss: 0.5687 (0.5787)  f1: 0.7146 (0.7146)
[2026-01-22 21:31:22] Epoch 39 Validation - acc: 0.7244 | loss: 0.5573
[2026-01-22 21:31:22] Epoch 39 Test - acc: 0.7146 | loss: 0.5787 | f1: 0.7146
[2026-01-22 21:31:23] Checkpoint saved at epoch 39
[2026-01-22 21:31:23] New best validation accuracy: 0.7244
[2026-01-22 21:36:54] Epoch 40 Training - loss: 0.5681 | lr: 0.0001 | acc: 0.7194
[2026-01-22 21:39:30] Test averaged stats: acc: 0.7500 (0.7104)  loss: 0.5554 (0.5797)  f1: 0.7090 (0.7090)
[2026-01-22 21:39:30] Epoch 40 Validation - acc: 0.6947 | loss: 0.5655
[2026-01-22 21:39:30] Epoch 40 Test - acc: 0.7104 | loss: 0.5797 | f1: 0.7090
[2026-01-22 21:39:30] Checkpoint saved at epoch 40
[2026-01-22 21:45:11] Epoch 41 Training - loss: 0.5689 | lr: 0.0001 | acc: 0.7145
[2026-01-22 21:47:53] Test averaged stats: acc: 0.7500 (0.7063)  loss: 0.5875 (0.5815)  f1: 0.7048 (0.7048)
[2026-01-22 21:47:53] Epoch 41 Validation - acc: 0.7075 | loss: 0.5585
[2026-01-22 21:47:53] Epoch 41 Test - acc: 0.7063 | loss: 0.5815 | f1: 0.7048
[2026-01-22 21:47:54] Checkpoint saved at epoch 41
[2026-01-22 21:53:13] Epoch 42 Training - loss: 0.5656 | lr: 0.0001 | acc: 0.7254
[2026-01-22 21:55:50] Test averaged stats: acc: 0.7500 (0.7188)  loss: 0.5714 (0.5779)  f1: 0.7186 (0.7186)
[2026-01-22 21:55:50] Epoch 42 Validation - acc: 0.7328 | loss: 0.5534
[2026-01-22 21:55:50] Epoch 42 Test - acc: 0.7188 | loss: 0.5779 | f1: 0.7186
[2026-01-22 21:55:51] Checkpoint saved at epoch 42
[2026-01-22 21:55:51] New best validation accuracy: 0.7328
[2026-01-22 22:01:15] Epoch 43 Training - loss: 0.5638 | lr: 0.0001 | acc: 0.7157
[2026-01-22 22:03:53] Test averaged stats: acc: 0.7500 (0.7083)  loss: 0.5596 (0.5744)  f1: 0.7079 (0.7079)
[2026-01-22 22:03:53] Epoch 43 Validation - acc: 0.7119 | loss: 0.5543
[2026-01-22 22:03:53] Epoch 43 Test - acc: 0.7083 | loss: 0.5744 | f1: 0.7079
[2026-01-22 22:03:53] Checkpoint saved at epoch 43
[2026-01-22 22:09:08] Epoch 44 Training - loss: 0.5634 | lr: 0.0001 | acc: 0.7151
[2026-01-22 22:11:37] Test averaged stats: acc: 0.7188 (0.7125)  loss: 0.5614 (0.5751)  f1: 0.7125 (0.7125)
[2026-01-22 22:11:37] Epoch 44 Validation - acc: 0.7286 | loss: 0.5513
[2026-01-22 22:11:37] Epoch 44 Test - acc: 0.7125 | loss: 0.5751 | f1: 0.7125
[2026-01-22 22:11:37] Checkpoint saved at epoch 44
[2026-01-22 22:16:56] Epoch 45 Training - loss: 0.5603 | lr: 0.0001 | acc: 0.7175
[2026-01-22 22:19:31] Test averaged stats: acc: 0.7500 (0.7167)  loss: 0.5485 (0.5747)  f1: 0.7144 (0.7144)
[2026-01-22 22:19:31] Epoch 45 Validation - acc: 0.7036 | loss: 0.5579
[2026-01-22 22:19:31] Epoch 45 Test - acc: 0.7167 | loss: 0.5747 | f1: 0.7144
[2026-01-22 22:19:31] Checkpoint saved at epoch 45
[2026-01-22 22:25:11] Epoch 46 Training - loss: 0.5620 | lr: 0.0001 | acc: 0.7194
[2026-01-22 22:27:44] Test averaged stats: acc: 0.7188 (0.7167)  loss: 0.5545 (0.5725)  f1: 0.7167 (0.7167)
[2026-01-22 22:27:44] Epoch 46 Validation - acc: 0.7200 | loss: 0.5499
[2026-01-22 22:27:44] Epoch 46 Test - acc: 0.7167 | loss: 0.5725 | f1: 0.7167
[2026-01-22 22:27:45] Checkpoint saved at epoch 46
[2026-01-22 22:33:00] Epoch 47 Training - loss: 0.5571 | lr: 0.0001 | acc: 0.7218
[2026-01-22 22:35:40] Test averaged stats: acc: 0.7500 (0.7146)  loss: 0.5605 (0.5731)  f1: 0.7145 (0.7145)
[2026-01-22 22:35:40] Epoch 47 Validation - acc: 0.7200 | loss: 0.5499
[2026-01-22 22:35:40] Epoch 47 Test - acc: 0.7146 | loss: 0.5731 | f1: 0.7145
[2026-01-22 22:35:40] Checkpoint saved at epoch 47
[2026-01-22 22:41:08] Epoch 48 Training - loss: 0.5572 | lr: 0.0001 | acc: 0.7200
[2026-01-22 22:43:46] Test averaged stats: acc: 0.7500 (0.7146)  loss: 0.5864 (0.5781)  f1: 0.7135 (0.7135)
[2026-01-22 22:43:46] Epoch 48 Validation - acc: 0.7328 | loss: 0.5494
[2026-01-22 22:43:46] Epoch 48 Test - acc: 0.7146 | loss: 0.5781 | f1: 0.7135
[2026-01-22 22:43:46] Checkpoint saved at epoch 48
[2026-01-22 22:48:53] Epoch 49 Training - loss: 0.5599 | lr: 0.0001 | acc: 0.7266
[2026-01-22 22:51:27] Test averaged stats: acc: 0.7188 (0.7083)  loss: 0.5673 (0.5734)  f1: 0.7083 (0.7083)
[2026-01-22 22:51:27] Epoch 49 Validation - acc: 0.7244 | loss: 0.5459
[2026-01-22 22:51:27] Epoch 49 Test - acc: 0.7083 | loss: 0.5734 | f1: 0.7083
[2026-01-22 22:51:27] Checkpoint saved at epoch 49
[2026-01-22 22:56:44] Epoch 50 Training - loss: 0.5586 | lr: 0.0001 | acc: 0.7320
[2026-01-22 22:59:28] Test averaged stats: acc: 0.7500 (0.7083)  loss: 0.5701 (0.5736)  f1: 0.7083 (0.7083)
[2026-01-22 22:59:28] Epoch 50 Validation - acc: 0.7286 | loss: 0.5450
[2026-01-22 22:59:28] Epoch 50 Test - acc: 0.7083 | loss: 0.5736 | f1: 0.7083
[2026-01-22 22:59:29] Checkpoint saved at epoch 50
[2026-01-22 23:04:51] Epoch 51 Training - loss: 0.5551 | lr: 0.0000 | acc: 0.7236
[2026-01-22 23:07:23] Test averaged stats: acc: 0.7500 (0.7125)  loss: 0.5747 (0.5748)  f1: 0.7122 (0.7122)
[2026-01-22 23:07:23] Epoch 51 Validation - acc: 0.7369 | loss: 0.5449
[2026-01-22 23:07:23] Epoch 51 Test - acc: 0.7125 | loss: 0.5748 | f1: 0.7122
[2026-01-22 23:07:23] Checkpoint saved at epoch 51
[2026-01-22 23:07:23] New best validation accuracy: 0.7369
[2026-01-22 23:12:41] Epoch 52 Training - loss: 0.5539 | lr: 0.0000 | acc: 0.7344
[2026-01-22 23:15:11] Test averaged stats: acc: 0.7500 (0.7208)  loss: 0.5697 (0.5729)  f1: 0.7207 (0.7207)
[2026-01-22 23:15:11] Epoch 52 Validation - acc: 0.7411 | loss: 0.5441
[2026-01-22 23:15:11] Epoch 52 Test - acc: 0.7208 | loss: 0.5729 | f1: 0.7207
[2026-01-22 23:15:11] Checkpoint saved at epoch 52
[2026-01-22 23:15:11] New best validation accuracy: 0.7411
[2026-01-22 23:20:30] Epoch 53 Training - loss: 0.5553 | lr: 0.0000 | acc: 0.7308
[2026-01-22 23:23:08] Test averaged stats: acc: 0.7188 (0.7208)  loss: 0.5641 (0.5710)  f1: 0.7208 (0.7208)
[2026-01-22 23:23:08] Epoch 53 Validation - acc: 0.7286 | loss: 0.5438
[2026-01-22 23:23:08] Epoch 53 Test - acc: 0.7208 | loss: 0.5710 | f1: 0.7208
[2026-01-22 23:23:09] Checkpoint saved at epoch 53
[2026-01-22 23:28:31] Epoch 54 Training - loss: 0.5555 | lr: 0.0000 | acc: 0.7218
[2026-01-22 23:31:06] Test averaged stats: acc: 0.7500 (0.7188)  loss: 0.5510 (0.5696)  f1: 0.7184 (0.7184)
[2026-01-22 23:31:06] Epoch 54 Validation - acc: 0.7325 | loss: 0.5468
[2026-01-22 23:31:06] Epoch 54 Test - acc: 0.7188 | loss: 0.5696 | f1: 0.7184
[2026-01-22 23:31:07] Checkpoint saved at epoch 54
[2026-01-22 23:36:29] Epoch 55 Training - loss: 0.5532 | lr: 0.0000 | acc: 0.7254
[2026-01-22 23:39:15] Test averaged stats: acc: 0.7500 (0.7208)  loss: 0.5635 (0.5709)  f1: 0.7208 (0.7208)
[2026-01-22 23:39:15] Epoch 55 Validation - acc: 0.7328 | loss: 0.5431
[2026-01-22 23:39:15] Epoch 55 Test - acc: 0.7208 | loss: 0.5709 | f1: 0.7208
[2026-01-22 23:39:16] Checkpoint saved at epoch 55
[2026-01-22 23:44:37] Epoch 56 Training - loss: 0.5554 | lr: 0.0000 | acc: 0.7212
[2026-01-22 23:47:11] Test averaged stats: acc: 0.7188 (0.7250)  loss: 0.5605 (0.5690)  f1: 0.7250 (0.7250)
[2026-01-22 23:47:11] Epoch 56 Validation - acc: 0.7283 | loss: 0.5428
[2026-01-22 23:47:11] Epoch 56 Test - acc: 0.7250 | loss: 0.5690 | f1: 0.7250
[2026-01-22 23:47:11] Checkpoint saved at epoch 56
[2026-01-22 23:52:32] Epoch 57 Training - loss: 0.5514 | lr: 0.0000 | acc: 0.7290
[2026-01-22 23:55:02] Test averaged stats: acc: 0.7500 (0.7312)  loss: 0.5636 (0.5701)  f1: 0.7313 (0.7313)
[2026-01-22 23:55:02] Epoch 57 Validation - acc: 0.7325 | loss: 0.5415
[2026-01-22 23:55:02] Epoch 57 Test - acc: 0.7312 | loss: 0.5701 | f1: 0.7313
[2026-01-22 23:55:03] Checkpoint saved at epoch 57
[2026-01-23 00:00:48] Epoch 58 Training - loss: 0.5516 | lr: 0.0000 | acc: 0.7272
[2026-01-23 00:03:27] Test averaged stats: acc: 0.7500 (0.7146)  loss: 0.5788 (0.5748)  f1: 0.7135 (0.7135)
[2026-01-23 00:03:27] Epoch 58 Validation - acc: 0.7075 | loss: 0.5428
[2026-01-23 00:03:27] Epoch 58 Test - acc: 0.7146 | loss: 0.5748 | f1: 0.7135
[2026-01-23 00:03:27] Checkpoint saved at epoch 58
[2026-01-23 00:09:16] Epoch 59 Training - loss: 0.5495 | lr: 0.0000 | acc: 0.7272
[2026-01-23 00:11:55] Test averaged stats: acc: 0.7500 (0.7125)  loss: 0.5452 (0.5677)  f1: 0.7116 (0.7116)
[2026-01-23 00:11:55] Epoch 59 Validation - acc: 0.7328 | loss: 0.5468
[2026-01-23 00:11:55] Epoch 59 Test - acc: 0.7125 | loss: 0.5677 | f1: 0.7116
[2026-01-23 00:11:55] Checkpoint saved at epoch 59
[2026-01-23 00:17:37] Epoch 60 Training - loss: 0.5493 | lr: 0.0000 | acc: 0.7242
[2026-01-23 00:20:18] Test averaged stats: acc: 0.7188 (0.7146)  loss: 0.5622 (0.5687)  f1: 0.7146 (0.7146)
[2026-01-23 00:20:18] Epoch 60 Validation - acc: 0.7325 | loss: 0.5403
[2026-01-23 00:20:18] Epoch 60 Test - acc: 0.7146 | loss: 0.5687 | f1: 0.7146
[2026-01-23 00:20:18] Checkpoint saved at epoch 60
[2026-01-23 00:26:03] Epoch 61 Training - loss: 0.5483 | lr: 0.0000 | acc: 0.7314
[2026-01-23 00:28:49] Test averaged stats: acc: 0.7500 (0.7167)  loss: 0.5488 (0.5693)  f1: 0.7160 (0.7160)
[2026-01-23 00:28:49] Epoch 61 Validation - acc: 0.7242 | loss: 0.5455
[2026-01-23 00:28:49] Epoch 61 Test - acc: 0.7167 | loss: 0.5693 | f1: 0.7160
[2026-01-23 00:28:50] Checkpoint saved at epoch 61
[2026-01-23 00:34:14] Epoch 62 Training - loss: 0.5499 | lr: 0.0000 | acc: 0.7272
[2026-01-23 00:36:52] Test averaged stats: acc: 0.7500 (0.7167)  loss: 0.5523 (0.5679)  f1: 0.7164 (0.7164)
[2026-01-23 00:36:52] Epoch 62 Validation - acc: 0.7325 | loss: 0.5416
[2026-01-23 00:36:52] Epoch 62 Test - acc: 0.7167 | loss: 0.5679 | f1: 0.7164
[2026-01-23 00:36:52] Checkpoint saved at epoch 62
[2026-01-23 00:42:09] Epoch 63 Training - loss: 0.5489 | lr: 0.0000 | acc: 0.7326
[2026-01-23 00:44:55] Test averaged stats: acc: 0.7500 (0.7208)  loss: 0.5520 (0.5669)  f1: 0.7206 (0.7206)
[2026-01-23 00:44:55] Epoch 63 Validation - acc: 0.7325 | loss: 0.5401
[2026-01-23 00:44:55] Epoch 63 Test - acc: 0.7208 | loss: 0.5669 | f1: 0.7206
[2026-01-23 00:44:56] Checkpoint saved at epoch 63
[2026-01-23 00:50:33] Epoch 64 Training - loss: 0.5473 | lr: 0.0000 | acc: 0.7344
[2026-01-23 00:53:25] Test averaged stats: acc: 0.7188 (0.7188)  loss: 0.5630 (0.5680)  f1: 0.7187 (0.7187)
[2026-01-23 00:53:25] Epoch 64 Validation - acc: 0.7283 | loss: 0.5375
[2026-01-23 00:53:25] Epoch 64 Test - acc: 0.7188 | loss: 0.5680 | f1: 0.7187
[2026-01-23 00:53:25] Checkpoint saved at epoch 64
[2026-01-23 00:59:10] Epoch 65 Training - loss: 0.5486 | lr: 0.0000 | acc: 0.7332
[2026-01-23 01:01:52] Test averaged stats: acc: 0.7188 (0.7208)  loss: 0.5699 (0.5689)  f1: 0.7208 (0.7208)
[2026-01-23 01:01:52] Epoch 65 Validation - acc: 0.7369 | loss: 0.5370
[2026-01-23 01:01:52] Epoch 65 Test - acc: 0.7208 | loss: 0.5689 | f1: 0.7208
[2026-01-23 01:01:53] Checkpoint saved at epoch 65
[2026-01-23 01:07:30] Epoch 66 Training - loss: 0.5468 | lr: 0.0000 | acc: 0.7332
[2026-01-23 01:10:19] Test averaged stats: acc: 0.7500 (0.7167)  loss: 0.5457 (0.5665)  f1: 0.7162 (0.7162)
[2026-01-23 01:10:19] Epoch 66 Validation - acc: 0.7328 | loss: 0.5398
[2026-01-23 01:10:19] Epoch 66 Test - acc: 0.7167 | loss: 0.5665 | f1: 0.7162
[2026-01-23 01:10:19] Checkpoint saved at epoch 66
[2026-01-23 01:16:08] Epoch 67 Training - loss: 0.5504 | lr: 0.0000 | acc: 0.7272
[2026-01-23 01:18:57] Test averaged stats: acc: 0.7500 (0.7292)  loss: 0.5711 (0.5694)  f1: 0.7291 (0.7291)
[2026-01-23 01:18:57] Epoch 67 Validation - acc: 0.7411 | loss: 0.5354
[2026-01-23 01:18:57] Epoch 67 Test - acc: 0.7292 | loss: 0.5694 | f1: 0.7291
[2026-01-23 01:18:58] Checkpoint saved at epoch 67
[2026-01-23 01:24:26] Epoch 68 Training - loss: 0.5462 | lr: 0.0000 | acc: 0.7350
[2026-01-23 01:27:01] Test averaged stats: acc: 0.7500 (0.7250)  loss: 0.5518 (0.5663)  f1: 0.7247 (0.7247)
[2026-01-23 01:27:01] Epoch 68 Validation - acc: 0.7369 | loss: 0.5386
[2026-01-23 01:27:01] Epoch 68 Test - acc: 0.7250 | loss: 0.5663 | f1: 0.7247
[2026-01-23 01:27:01] Checkpoint saved at epoch 68
[2026-01-23 01:32:33] Epoch 69 Training - loss: 0.5477 | lr: 0.0000 | acc: 0.7278
[2026-01-23 01:35:07] Test averaged stats: acc: 0.7500 (0.7292)  loss: 0.5654 (0.5674)  f1: 0.7292 (0.7292)
[2026-01-23 01:35:07] Epoch 69 Validation - acc: 0.7239 | loss: 0.5371
[2026-01-23 01:35:07] Epoch 69 Test - acc: 0.7292 | loss: 0.5674 | f1: 0.7292
[2026-01-23 01:35:07] Checkpoint saved at epoch 69
[2026-01-23 01:40:27] Epoch 70 Training - loss: 0.5430 | lr: 0.0000 | acc: 0.7392
[2026-01-23 01:43:10] Test averaged stats: acc: 0.7500 (0.7271)  loss: 0.5690 (0.5692)  f1: 0.7269 (0.7269)
[2026-01-23 01:43:10] Epoch 70 Validation - acc: 0.7242 | loss: 0.5355
[2026-01-23 01:43:10] Epoch 70 Test - acc: 0.7271 | loss: 0.5692 | f1: 0.7269
[2026-01-23 01:43:10] Checkpoint saved at epoch 70
[2026-01-23 01:49:03] Epoch 71 Training - loss: 0.5495 | lr: 0.0000 | acc: 0.7296
[2026-01-23 01:51:55] Test averaged stats: acc: 0.7500 (0.7250)  loss: 0.5637 (0.5671)  f1: 0.7250 (0.7250)
[2026-01-23 01:51:55] Epoch 71 Validation - acc: 0.7367 | loss: 0.5359
[2026-01-23 01:51:55] Epoch 71 Test - acc: 0.7250 | loss: 0.5671 | f1: 0.7250
[2026-01-23 01:51:55] Checkpoint saved at epoch 71
[2026-01-23 01:57:25] Epoch 72 Training - loss: 0.5425 | lr: 0.0000 | acc: 0.7362
[2026-01-23 02:00:05] Test averaged stats: acc: 0.7188 (0.7250)  loss: 0.5693 (0.5694)  f1: 0.7248 (0.7248)
[2026-01-23 02:00:05] Epoch 72 Validation - acc: 0.7200 | loss: 0.5352
[2026-01-23 02:00:05] Epoch 72 Test - acc: 0.7250 | loss: 0.5694 | f1: 0.7248
[2026-01-23 02:00:05] Checkpoint saved at epoch 72
[2026-01-23 02:05:38] Epoch 73 Training - loss: 0.5441 | lr: 0.0000 | acc: 0.7356
[2026-01-23 02:08:27] Test averaged stats: acc: 0.7812 (0.7333)  loss: 0.5693 (0.5699)  f1: 0.7329 (0.7329)
[2026-01-23 02:08:27] Epoch 73 Validation - acc: 0.7283 | loss: 0.5351
[2026-01-23 02:08:27] Epoch 73 Test - acc: 0.7333 | loss: 0.5699 | f1: 0.7329
[2026-01-23 02:08:27] Checkpoint saved at epoch 73
[2026-01-23 02:14:13] Epoch 74 Training - loss: 0.5426 | lr: 0.0000 | acc: 0.7278
[2026-01-23 02:17:02] Test averaged stats: acc: 0.7500 (0.7229)  loss: 0.5611 (0.5665)  f1: 0.7229 (0.7229)
[2026-01-23 02:17:02] Epoch 74 Validation - acc: 0.7411 | loss: 0.5353
[2026-01-23 02:17:02] Epoch 74 Test - acc: 0.7229 | loss: 0.5665 | f1: 0.7229
[2026-01-23 02:17:03] Checkpoint saved at epoch 74
[2026-01-23 02:22:48] Epoch 75 Training - loss: 0.5447 | lr: 0.0000 | acc: 0.7404
[2026-01-23 02:25:41] Test averaged stats: acc: 0.7500 (0.7229)  loss: 0.5640 (0.5672)  f1: 0.7229 (0.7229)
[2026-01-23 02:25:41] Epoch 75 Validation - acc: 0.7325 | loss: 0.5354
[2026-01-23 02:25:41] Epoch 75 Test - acc: 0.7229 | loss: 0.5672 | f1: 0.7229
[2026-01-23 02:25:41] Checkpoint saved at epoch 75
[2026-01-23 02:31:10] Epoch 76 Training - loss: 0.5450 | lr: 0.0000 | acc: 0.7338
[2026-01-23 02:33:52] Test averaged stats: acc: 0.7500 (0.7250)  loss: 0.5580 (0.5665)  f1: 0.7249 (0.7249)
[2026-01-23 02:33:52] Epoch 76 Validation - acc: 0.7367 | loss: 0.5357
[2026-01-23 02:33:52] Epoch 76 Test - acc: 0.7250 | loss: 0.5665 | f1: 0.7249
[2026-01-23 02:33:53] Checkpoint saved at epoch 76
[2026-01-23 02:39:23] Epoch 77 Training - loss: 0.5429 | lr: 0.0000 | acc: 0.7308
[2026-01-23 02:42:00] Test averaged stats: acc: 0.7500 (0.7312)  loss: 0.5696 (0.5675)  f1: 0.7313 (0.7313)
[2026-01-23 02:42:00] Epoch 77 Validation - acc: 0.7325 | loss: 0.5343
[2026-01-23 02:42:00] Epoch 77 Test - acc: 0.7312 | loss: 0.5675 | f1: 0.7313
[2026-01-23 02:42:00] Checkpoint saved at epoch 77
[2026-01-23 02:47:15] Epoch 78 Training - loss: 0.5423 | lr: 0.0000 | acc: 0.7368
[2026-01-23 02:49:47] Test averaged stats: acc: 0.7500 (0.7229)  loss: 0.5601 (0.5663)  f1: 0.7229 (0.7229)
[2026-01-23 02:49:47] Epoch 78 Validation - acc: 0.7281 | loss: 0.5356
[2026-01-23 02:49:47] Epoch 78 Test - acc: 0.7229 | loss: 0.5663 | f1: 0.7229
[2026-01-23 02:49:47] Checkpoint saved at epoch 78
[2026-01-23 02:55:11] Epoch 79 Training - loss: 0.5419 | lr: 0.0000 | acc: 0.7302
[2026-01-23 02:57:51] Test averaged stats: acc: 0.7500 (0.7271)  loss: 0.5670 (0.5667)  f1: 0.7271 (0.7271)
[2026-01-23 02:57:51] Epoch 79 Validation - acc: 0.7281 | loss: 0.5348
[2026-01-23 02:57:51] Epoch 79 Test - acc: 0.7271 | loss: 0.5667 | f1: 0.7271
[2026-01-23 02:57:51] Checkpoint saved at epoch 79
[2026-01-23 03:03:13] Epoch 80 Training - loss: 0.5430 | lr: 0.0000 | acc: 0.7314
[2026-01-23 03:05:45] Test averaged stats: acc: 0.7500 (0.7333)  loss: 0.5689 (0.5674)  f1: 0.7333 (0.7333)
[2026-01-23 03:05:45] Epoch 80 Validation - acc: 0.7325 | loss: 0.5342
[2026-01-23 03:05:45] Epoch 80 Test - acc: 0.7333 | loss: 0.5674 | f1: 0.7333
[2026-01-23 03:05:45] Checkpoint saved at epoch 80
[2026-01-23 03:11:02] Epoch 81 Training - loss: 0.5447 | lr: 0.0000 | acc: 0.7302
[2026-01-23 03:13:35] Test averaged stats: acc: 0.7500 (0.7229)  loss: 0.5652 (0.5667)  f1: 0.7229 (0.7229)
[2026-01-23 03:13:35] Epoch 81 Validation - acc: 0.7281 | loss: 0.5348
[2026-01-23 03:13:35] Epoch 81 Test - acc: 0.7229 | loss: 0.5667 | f1: 0.7229
[2026-01-23 03:13:35] Checkpoint saved at epoch 81
[2026-01-23 03:19:06] Epoch 82 Training - loss: 0.5431 | lr: 0.0000 | acc: 0.7362
[2026-01-23 03:21:41] Test averaged stats: acc: 0.7500 (0.7250)  loss: 0.5639 (0.5665)  f1: 0.7250 (0.7250)
[2026-01-23 03:21:41] Epoch 82 Validation - acc: 0.7281 | loss: 0.5347
[2026-01-23 03:21:41] Epoch 82 Test - acc: 0.7250 | loss: 0.5665 | f1: 0.7250
[2026-01-23 03:21:41] Checkpoint saved at epoch 82
[2026-01-23 03:27:00] Epoch 83 Training - loss: 0.5434 | lr: 0.0000 | acc: 0.7350
[2026-01-23 03:29:37] Test averaged stats: acc: 0.7500 (0.7229)  loss: 0.5606 (0.5663)  f1: 0.7229 (0.7229)
[2026-01-23 03:29:37] Epoch 83 Validation - acc: 0.7325 | loss: 0.5348
[2026-01-23 03:29:37] Epoch 83 Test - acc: 0.7229 | loss: 0.5663 | f1: 0.7229
[2026-01-23 03:29:37] Checkpoint saved at epoch 83
[2026-01-23 03:35:00] Epoch 84 Training - loss: 0.5418 | lr: 0.0000 | acc: 0.7296
[2026-01-23 03:37:44] Test averaged stats: acc: 0.7500 (0.7229)  loss: 0.5650 (0.5664)  f1: 0.7229 (0.7229)
[2026-01-23 03:37:44] Epoch 84 Validation - acc: 0.7281 | loss: 0.5343
[2026-01-23 03:37:44] Epoch 84 Test - acc: 0.7229 | loss: 0.5664 | f1: 0.7229
[2026-01-23 03:37:45] Checkpoint saved at epoch 84
[2026-01-23 03:43:16] Epoch 85 Training - loss: 0.5411 | lr: 0.0000 | acc: 0.7350
[2026-01-23 03:45:50] Test averaged stats: acc: 0.7500 (0.7312)  loss: 0.5688 (0.5668)  f1: 0.7313 (0.7313)
[2026-01-23 03:45:50] Epoch 85 Validation - acc: 0.7367 | loss: 0.5340
[2026-01-23 03:45:50] Epoch 85 Test - acc: 0.7312 | loss: 0.5668 | f1: 0.7313
[2026-01-23 03:45:50] Checkpoint saved at epoch 85
[2026-01-23 03:51:07] Epoch 86 Training - loss: 0.5440 | lr: 0.0000 | acc: 0.7326
[2026-01-23 03:53:51] Test averaged stats: acc: 0.7500 (0.7229)  loss: 0.5607 (0.5661)  f1: 0.7229 (0.7229)
[2026-01-23 03:53:51] Epoch 86 Validation - acc: 0.7325 | loss: 0.5346
[2026-01-23 03:53:51] Epoch 86 Test - acc: 0.7229 | loss: 0.5661 | f1: 0.7229
[2026-01-23 03:53:51] Checkpoint saved at epoch 86
[2026-01-23 03:59:08] Epoch 87 Training - loss: 0.5431 | lr: 0.0000 | acc: 0.7344
[2026-01-23 04:01:49] Test averaged stats: acc: 0.7500 (0.7229)  loss: 0.5615 (0.5661)  f1: 0.7229 (0.7229)
[2026-01-23 04:01:49] Epoch 87 Validation - acc: 0.7367 | loss: 0.5343
[2026-01-23 04:01:49] Epoch 87 Test - acc: 0.7229 | loss: 0.5661 | f1: 0.7229
[2026-01-23 04:01:49] Checkpoint saved at epoch 87
[2026-01-23 04:07:14] Epoch 88 Training - loss: 0.5397 | lr: 0.0000 | acc: 0.7368
[2026-01-23 04:09:42] Test averaged stats: acc: 0.7500 (0.7229)  loss: 0.5614 (0.5661)  f1: 0.7229 (0.7229)
[2026-01-23 04:09:42] Epoch 88 Validation - acc: 0.7325 | loss: 0.5344
[2026-01-23 04:09:42] Epoch 88 Test - acc: 0.7229 | loss: 0.5661 | f1: 0.7229
[2026-01-23 04:09:43] Checkpoint saved at epoch 88
[2026-01-23 04:14:44] Epoch 89 Training - loss: 0.5395 | lr: 0.0000 | acc: 0.7386
[2026-01-23 04:17:13] Test averaged stats: acc: 0.7500 (0.7229)  loss: 0.5628 (0.5662)  f1: 0.7229 (0.7229)
[2026-01-23 04:17:13] Epoch 89 Validation - acc: 0.7325 | loss: 0.5342
[2026-01-23 04:17:13] Epoch 89 Test - acc: 0.7229 | loss: 0.5662 | f1: 0.7229
[2026-01-23 04:17:13] Checkpoint saved at epoch 89
[2026-01-23 04:22:21] Epoch 90 Training - loss: 0.5420 | lr: 0.0000 | acc: 0.7350
[2026-01-23 04:24:47] Test averaged stats: acc: 0.7500 (0.7229)  loss: 0.5615 (0.5660)  f1: 0.7229 (0.7229)
[2026-01-23 04:24:47] Epoch 90 Validation - acc: 0.7325 | loss: 0.5343
[2026-01-23 04:24:47] Epoch 90 Test - acc: 0.7229 | loss: 0.5660 | f1: 0.7229
[2026-01-23 04:24:47] Checkpoint saved at epoch 90
[2026-01-23 04:29:53] Epoch 91 Training - loss: 0.5397 | lr: 0.0000 | acc: 0.7374
[2026-01-23 04:32:30] Test averaged stats: acc: 0.7500 (0.7250)  loss: 0.5651 (0.5663)  f1: 0.7250 (0.7250)
[2026-01-23 04:32:30] Epoch 91 Validation - acc: 0.7281 | loss: 0.5339
[2026-01-23 04:32:30] Epoch 91 Test - acc: 0.7250 | loss: 0.5663 | f1: 0.7250
[2026-01-23 04:32:31] Checkpoint saved at epoch 91
[2026-01-23 04:38:42] Epoch 92 Training - loss: 0.5345 | lr: 0.0000 | acc: 0.7440
[2026-01-23 04:41:46] Test averaged stats: acc: 0.7500 (0.7250)  loss: 0.5653 (0.5663)  f1: 0.7250 (0.7250)
[2026-01-23 04:41:46] Epoch 92 Validation - acc: 0.7281 | loss: 0.5339
[2026-01-23 04:41:46] Epoch 92 Test - acc: 0.7250 | loss: 0.5663 | f1: 0.7250
[2026-01-23 04:41:46] Checkpoint saved at epoch 92
[2026-01-23 04:48:07] Epoch 93 Training - loss: 0.5434 | lr: 0.0000 | acc: 0.7302
[2026-01-23 04:51:22] Test averaged stats: acc: 0.7500 (0.7250)  loss: 0.5640 (0.5662)  f1: 0.7250 (0.7250)
[2026-01-23 04:51:22] Epoch 93 Validation - acc: 0.7281 | loss: 0.5341
[2026-01-23 04:51:22] Epoch 93 Test - acc: 0.7250 | loss: 0.5662 | f1: 0.7250
[2026-01-23 04:51:26] Checkpoint saved at epoch 93
[2026-01-23 04:58:14] Epoch 94 Training - loss: 0.5410 | lr: 0.0000 | acc: 0.7368
[2026-01-23 05:01:25] Test averaged stats: acc: 0.7500 (0.7250)  loss: 0.5635 (0.5662)  f1: 0.7250 (0.7250)
[2026-01-23 05:01:25] Epoch 94 Validation - acc: 0.7281 | loss: 0.5341
[2026-01-23 05:01:25] Epoch 94 Test - acc: 0.7250 | loss: 0.5662 | f1: 0.7250
[2026-01-23 05:01:26] Checkpoint saved at epoch 94
[2026-01-23 05:08:06] Epoch 95 Training - loss: 0.5420 | lr: 0.0000 | acc: 0.7338
[2026-01-23 05:11:19] Test averaged stats: acc: 0.7500 (0.7250)  loss: 0.5638 (0.5662)  f1: 0.7250 (0.7250)
[2026-01-23 05:11:19] Epoch 95 Validation - acc: 0.7281 | loss: 0.5340
[2026-01-23 05:11:19] Epoch 95 Test - acc: 0.7250 | loss: 0.5662 | f1: 0.7250
[2026-01-23 05:11:20] Checkpoint saved at epoch 95
[2026-01-23 05:17:55] Epoch 96 Training - loss: 0.5386 | lr: 0.0000 | acc: 0.7398
[2026-01-23 05:21:09] Test averaged stats: acc: 0.7500 (0.7229)  loss: 0.5643 (0.5662)  f1: 0.7229 (0.7229)
[2026-01-23 05:21:09] Epoch 96 Validation - acc: 0.7281 | loss: 0.5339
[2026-01-23 05:21:09] Epoch 96 Test - acc: 0.7229 | loss: 0.5662 | f1: 0.7229
[2026-01-23 05:21:10] Checkpoint saved at epoch 96
[2026-01-23 05:27:53] Epoch 97 Training - loss: 0.5381 | lr: 0.0000 | acc: 0.7398
[2026-01-23 05:31:09] Test averaged stats: acc: 0.7500 (0.7250)  loss: 0.5638 (0.5662)  f1: 0.7250 (0.7250)
[2026-01-23 05:31:09] Epoch 97 Validation - acc: 0.7281 | loss: 0.5340
[2026-01-23 05:31:09] Epoch 97 Test - acc: 0.7250 | loss: 0.5662 | f1: 0.7250
[2026-01-23 05:31:09] Checkpoint saved at epoch 97
[2026-01-23 05:37:57] Epoch 98 Training - loss: 0.5382 | lr: 0.0000 | acc: 0.7404
[2026-01-23 05:41:18] Test averaged stats: acc: 0.7500 (0.7229)  loss: 0.5645 (0.5663)  f1: 0.7229 (0.7229)
[2026-01-23 05:41:18] Epoch 98 Validation - acc: 0.7281 | loss: 0.5339
[2026-01-23 05:41:18] Epoch 98 Test - acc: 0.7229 | loss: 0.5663 | f1: 0.7229
[2026-01-23 05:41:19] Checkpoint saved at epoch 98
[2026-01-23 05:48:10] Epoch 99 Training - loss: 0.5418 | lr: 0.0000 | acc: 0.7296
[2026-01-23 05:51:18] Test averaged stats: acc: 0.7500 (0.7229)  loss: 0.5644 (0.5663)  f1: 0.7229 (0.7229)
[2026-01-23 05:51:18] Epoch 99 Validation - acc: 0.7281 | loss: 0.5339
[2026-01-23 05:51:18] Epoch 99 Test - acc: 0.7229 | loss: 0.5663 | f1: 0.7229
[2026-01-23 05:51:19] Checkpoint saved at epoch 99
[2026-01-23 05:51:19] ================================================================================
[2026-01-23 05:51:19] Fine-tuning completed in 14:09:00
[2026-01-23 05:51:19] Best validation accuracy: 0.7411
[2026-01-23 05:51:19] Total epochs: 100
[2026-01-23 05:51:19] Final learning rate: 0.000001
[2026-01-23 05:51:19] ================================================================================
[2026-01-23 05:53:18] 
================================================================================
[2026-01-23 05:53:18] Final Test Results
[2026-01-23 05:53:18] ================================================================================
[2026-01-23 05:53:18] acc: 0.7208
[2026-01-23 05:53:18] loss: 0.5729
[2026-01-23 05:53:18] f1: 0.7207
[2026-01-23 05:53:18] ================================================================================
